{
  "schema": "athena.risk_report.v1",
  "generated_at": "2026-08-01T21:41:06.797442+00:00",
  "day": "2026-08-01",
  "doctrine": "military_first_sda",
  "protocol": "military_baseline_train__suspect_score",
  "summary": {
    "n_scored": 24,
    "n_anomalies": 4,
    "n_military_detections": 4,
    "n_platform_health_flags": 0,
    "n_pairs": 33,
    "n_pair_elevated": 11,
    "threshold": 0.5179916031645592,
    "focus": "suspect detection + asset protect; baseline = IF normality only"
  },
  "board": [
    {
      "norad_id": 41727,
      "object_name": "GAOFEN-3",
      "role": "suspect",
      "country": "CN",
      "purpose": "reconnaissance",
      "orbit_class": "LEO",
      "anomaly_score": 0.35686510372506614,
      "attention_score": 0.6889,
      "is_anomaly": true,
      "is_military_detection": true,
      "is_platform_health_flag": false,
      "is_calibration_object": false,
      "status": "PAIR_ELEVATED",
      "xgb_class": "SUSPECT",
      "data_quality": {
        "score": 0.5,
        "issues": [
          "tle_stale_127h",
          "gap_100h"
        ],
        "reliable": true,
        "tle_age_hours": 127.25979528194443
      },
      "features_snapshot": {
        "delta_sma_7d_km": -0.0036514444673230173,
        "shannon_entropy_sma_30d": 2.996641328663726,
        "hurst_exponent_sma": 0.7771696841522222,
        "kolmogorov_proxy_7d": 0.05263157894736842,
        "l1_cusum_sma": 0.0,
        "tle_age_hours": 127.25981373472221,
        "f10_7": 144.0,
        "f10_7_adj": 149.2,
        "ap_index": 6.0,
        "kp_mean": 1.3751250000000002,
        "f10_7_delta_7d": 3.0,
        "ap_mean_7d": 10.666666666666666,
        "ap_max_7d": 24.0,
        "ap_delta_7d": -4.666666666666666,
        "geomagnetic_storm": 0.0,
        "space_weather_available": 1.0,
        "min_distance_to_military_km": 91.41812715438937,
        "cointegration_pvalue": 0.07758068408321489
      },
      "pair": {
        "asset_norad": 35951,
        "asset_name": "DMSP 5D-3 F18 (USA 210)",
        "min_distance_km": 91.418,
        "cointegration_pvalue": 0.077581,
        "pair_risk": 0.9605,
        "risk_level": "CRITICAL"
      },
      "anomaly_onset": {
        "first_elevated_at": "2016-08-14 02:12:32.956704",
        "method": "if_first_soft",
        "threshold": 0.55,
        "soft_threshold": 0.45000000000000007,
        "sustained": 2,
        "n_windows_scored": 32,
        "max_score_in_scan": 0.5292259546656781,
        "sma_change_at": "2016-09-03 21:44:02.343552+00:00",
        "note": "Estimate: TLE window end / epoch -- not intent date or maneuver clock."
      },
      "window_end": "2026-07-27 14:24:58.566240",
      "score_delta_1d": null
    },
    {
      "norad_id": 32289,
      "object_name": "YAOGAN-3",
      "role": "suspect",
      "country": "CN",
      "purpose": "reconnaissance",
      "orbit_class": "LEO",
      "anomaly_score": 0.3634953958492296,
      "attention_score": 0.5573,
      "is_anomaly": true,
      "is_military_detection": true,
      "is_platform_health_flag": false,
      "is_calibration_object": false,
      "status": "PAIR_ELEVATED",
      "xgb_class": "SUSPECT",
      "data_quality": {
        "score": 0.5,
        "issues": [
          "tle_stale_127h",
          "gap_94h"
        ],
        "reliable": true,
        "tle_age_hours": 127.30087499361112
      },
      "features_snapshot": {
        "delta_sma_7d_km": -0.04536519357498037,
        "shannon_entropy_sma_30d": 2.6550505394177746,
        "hurst_exponent_sma": 0.8811026490861751,
        "kolmogorov_proxy_7d": 0.10526315789473684,
        "l1_cusum_sma": 0.0,
        "tle_age_hours": 127.30089357083334,
        "f10_7": 144.0,
        "f10_7_adj": 149.2,
        "ap_index": 6.0,
        "kp_mean": 1.3751250000000002,
        "f10_7_delta_7d": 3.0,
        "ap_mean_7d": 10.666666666666666,
        "ap_max_7d": 24.0,
        "ap_delta_7d": -4.666666666666666,
        "geomagnetic_storm": 0.0,
        "space_weather_available": 1.0,
        "min_distance_to_military_km": 19.749266227993758,
        "cointegration_pvalue": 0.5930822881074624
      },
      "pair": {
        "asset_norad": 31598,
        "asset_name": "COSMO-SKYMED 1",
        "min_distance_km": 19.749,
        "cointegration_pvalue": 0.593082,
        "pair_risk": 0.7159,
        "risk_level": "ELEVATED"
      },
      "anomaly_onset": {
        "first_elevated_at": "2014-02-11 21:45:01.512000+00:00",
        "method": "sma_change_fallback",
        "threshold": 0.55,
        "soft_threshold": 0.45000000000000007,
        "sustained": 2,
        "n_windows_scored": 32,
        "max_score_in_scan": 0.4435124824084411,
        "sma_change_at": "2014-02-11 21:45:01.512000+00:00",
        "note": "Estimate: TLE window end / epoch -- not intent date or maneuver clock."
      },
      "window_end": "2026-07-27 14:22:26.336352",
      "score_delta_1d": null
    },
    {
      "norad_id": 41038,
      "object_name": "YAOGAN-29",
      "role": "suspect",
      "country": "CN",
      "purpose": "reconnaissance",
      "orbit_class": "LEO",
      "anomaly_score": 0.3576470683241697,
      "attention_score": 0.5541,
      "is_anomaly": true,
      "is_military_detection": true,
      "is_platform_health_flag": false,
      "is_calibration_object": false,
      "status": "PAIR_ELEVATED",
      "xgb_class": "SUSPECT",
      "data_quality": {
        "score": 0.5,
        "issues": [
          "tle_stale_127h",
          "gap_96h"
        ],
        "reliable": true,
        "tle_age_hours": 127.49734601361111
      },
      "features_snapshot": {
        "delta_sma_7d_km": -0.025836958494437567,
        "shannon_entropy_sma_30d": 2.8258459340407507,
        "hurst_exponent_sma": 0.858458394203636,
        "kolmogorov_proxy_7d": 0.05263157894736842,
        "l1_cusum_sma": 0.0,
        "tle_age_hours": 127.49736417083334,
        "f10_7": 144.0,
        "f10_7_adj": 149.2,
        "ap_index": 6.0,
        "kp_mean": 1.3751250000000002,
        "f10_7_delta_7d": 3.0,
        "ap_mean_7d": 10.666666666666666,
        "ap_max_7d": 24.0,
        "ap_delta_7d": -4.666666666666666,
        "geomagnetic_storm": 0.0,
        "space_weather_available": 1.0,
        "min_distance_to_military_km": 44.18865253877448,
        "cointegration_pvalue": 0.5076582030900154
      },
      "pair": {
        "asset_norad": 35951,
        "asset_name": "DMSP 5D-3 F18 (USA 210)",
        "min_distance_km": 223.09,
        "cointegration_pvalue": 0.000334,
        "pair_risk": 0.7149,
        "risk_level": "ELEVATED"
      },
      "anomaly_onset": {
        "first_elevated_at": "2015-12-03 18:14:56.358528",
        "method": "if_first_soft",
        "threshold": 0.55,
        "soft_threshold": 0.45000000000000007,
        "sustained": 2,
        "n_windows_scored": 32,
        "max_score_in_scan": 0.4884332369562182,
        "sma_change_at": "2016-01-02 21:49:09.266592+00:00",
        "note": "Estimate: TLE window end / epoch -- not intent date or maneuver clock."
      },
      "window_end": "2026-07-27 14:10:42.845088",
      "score_delta_1d": null
    },
    {
      "norad_id": 39150,
      "object_name": "GAOFEN-1",
      "role": "suspect",
      "country": "CN",
      "purpose": "earth obs",
      "orbit_class": "LEO",
      "anomaly_score": 0.3569982958032984,
      "attention_score": 0.5206,
      "is_anomaly": true,
      "is_military_detection": true,
      "is_platform_health_flag": false,
      "is_calibration_object": false,
      "status": "PAIR_ELEVATED",
      "xgb_class": "SUSPECT",
      "data_quality": {
        "score": 0.5,
        "issues": [
          "tle_stale_128h",
          "gap_101h"
        ],
        "reliable": true,
        "tle_age_hours": 127.55986711555555
      },
      "features_snapshot": {
        "delta_sma_7d_km": -0.022356530296747223,
        "shannon_entropy_sma_30d": 2.900051698999543,
        "hurst_exponent_sma": 0.7928142735320657,
        "kolmogorov_proxy_7d": 0.05263157894736842,
        "l1_cusum_sma": 0.0,
        "tle_age_hours": 127.55988582638889,
        "f10_7": 144.0,
        "f10_7_adj": 149.2,
        "ap_index": 6.0,
        "kp_mean": 1.3751250000000002,
        "f10_7_delta_7d": 3.0,
        "ap_mean_7d": 10.666666666666666,
        "ap_max_7d": 24.0,
        "ap_delta_7d": -4.666666666666666,
        "geomagnetic_storm": 0.0,
        "space_weather_available": 1.0,
        "min_distance_to_military_km": 64.97883345570881,
        "cointegration_pvalue": 0.6086209800160178
      },
      "pair": {
        "asset_norad": 31598,
        "asset_name": "COSMO-SKYMED 1",
        "min_distance_km": 64.979,
        "cointegration_pvalue": 0.608621,
        "pair_risk": 0.6545,
        "risk_level": "ELEVATED"
      },
      "anomaly_onset": {
        "first_elevated_at": "2014-01-28 04:47:21.701472+00:00",
        "method": "sma_change_fallback",
        "threshold": 0.55,
        "soft_threshold": 0.45000000000000007,
        "sustained": 2,
        "n_windows_scored": 32,
        "max_score_in_scan": 0.4329681622971391,
        "sma_change_at": "2014-01-28 04:47:21.701472+00:00",
        "note": "Estimate: TLE window end / epoch -- not intent date or maneuver clock."
      },
      "window_end": "2026-07-27 14:06:55.608768",
      "score_delta_1d": null
    },
    {
      "norad_id": 50321,
      "object_name": "SHIYAN-12 01 (SY-12 01)",
      "role": "suspect",
      "country": "CN",
      "purpose": "military",
      "orbit_class": "LEO",
      "anomaly_score": 0.5042817846002361,
      "attention_score": 0.5042817846002361,
      "is_anomaly": false,
      "is_military_detection": false,
      "is_platform_health_flag": false,
      "is_calibration_object": false,
      "status": "UNRELIABLE_DATA",
      "xgb_class": "SUSPECT",
      "data_quality": {
        "score": 0.10000000000000003,
        "issues": [
          "tle_stale_149h",
          "gap_423h",
          "sma_jump"
        ],